<?xml version="1.0" encoding="UTF-8"?>
<JDBCConnection xmlns="http://www.BlowORM.org/BlowConf"
	xmlns:xsi="http://www.w3.org/2001/XMLSchema-instance"
	xsi:schemaLocation="http://www.BlowORM.org/BlowConf ../../BlowORM/src/com/sales/xmls/BlowConf.xsd">

	<!-- basic configs -->
	<URL>jdbc:oracle:thin:@localhost:1521:xe</URL>
	<PASSWORD>divyank99</PASSWORD>
	<USER>divyank</USER>
	<!-- Oracle10g driver class -->
	 <JDBCDriver>oracle.jdbc.driver.OracleDriver</JDBCDriver>
	
	<!-- Oracle11g driver class -->
	<!-- <JDBCDriver>oracle.jdbc.OracleDriver</JDBCDriver> -->
	
	<QUERIES>
		<Query file="com/sales/xmls/some.blow.query.xml"/>
		<Query file="com/sales/xmls/some.blow.query.xml"/>
	</QUERIES>

	<!-- mappings -->
	<MAPPINGS file="com/sales/xmls/first.blow.xml" />
	<MAPPINGS file="com/sales/xmls/second.blow.xml" />
	<!-- <MAPPINGS file="com/sales/xmls/three.blow.xml"/> -->
	
	<!-- config annotation -->
	<ANNOTATIONS use="true">
		<package-scan>com.sales.pojo</package-scan>
		<package-scan>com.customer.pojo</package-scan>
	</ANNOTATIONS>

	<!-- multiple schema can be mentioned for loading tables separated by comma -->
	<Schema>DIVYANK</Schema>
	<!-- generate schema -->
	<GenerateSchema>true</GenerateSchema>
	<SqlLogging>true</SqlLogging>
</JDBCConnection>